{
  "schema_version": 1,
  "policy_id": "repo-kit.repo-consistency.default",
  "description": "Declarative policy rules consumed by scripts/lifecycle/check_repo_consistency.py.",
  "updated": "2026-06-04",
  "local_override_files": [
    "repo-standards/policies/local_repo_consistency_policy.json"
  ],
  "rules": [
    {
      "id": "repo-standards.required-artifacts",
      "type": "required_paths",
      "description": "Repo-kit source checkout must include first-class docs, scripts, templates, schemas, examples, and policy assets.",
      "severity": "error",
      "applies_to": [
        "repo-kit"
      ],
      "remediation": "Restore the missing artifact from repo-kit source, regenerate it through the documented script, or update this policy only when the baseline intentionally changes.",
      "downstream_override": {
        "allowed": true,
        "mode": "local_policy_overlay",
        "notes": "Downstream repos may keep local policy overlays; standards install copies managed defaults without deleting local files."
      },
      "paths": [
        "AGENTS.md",
        ".github/CODEOWNERS",
        ".github/workflows/scorecard.yml",
        "archive/local-reports/downstream_drift_report.schema.json",
        "archive/local-reports/downstream_update_watch_report.schema.json",
        "archive/local-reports/downstream_upgrade_dashboard_report.schema.json",
        "archive/local-reports/exchange_apply_report.schema.json",
        "archive/local-reports/exchange_dashboard_report.schema.json",
        "archive/local-reports/logging_assets_migration_report.schema.json",
        "archive/local-reports/prepared_repo_updates_report.schema.json",
        "archive/local-reports/repo_upgrade_plan.schema.json",
        "archive/local-reports/solution_cli_report.schema.json",
        "archive/local-reports/update_impact_preview.schema.json",
        "docs/adr/README.md",
        "LICENSE",
        "docs/AUTO_APPLY_POLICY.md",
        "docs/CHANGELOG_POLICY.md",
        "docs/changelogs/cline-rules.md",
        "docs/changelogs/cline-skills.md",
        "docs/changelogs/cline-workflows.md",
        "docs/CLINE_LOGGING_GUIDE.md",
        "docs/CLINE_PERFORMANCE_BASELINE.json",
        "docs/CLINE_PERFORMANCE_BASELINE.md",
        "docs/CLINE_UNREAL_GUIDE.md",
        "docs/COMMIT_CONVENTIONS.md",
        "docs/CROSS_REPO_ASSET_VERSIONING.md",
        "docs/CROSS_REPO_EXCHANGE.md",
        "docs/CROSS_REPO_REUSE_LOOP.md",
        "docs/DECISIONS.md",
        "docs/DEPENDENCY_DASHBOARD.md",
        "docs/DEPENDENCY_UPDATE_POLICY.md",
        "docs/DEVCONTAINER_POLICY.md",
        "docs/DOWNSTREAM_ROLLOUT_PLAYBOOK.md",
        "docs/DOWNSTREAM_UPDATE_WATCH.md",
        "docs/DOWNSTREAM_UPGRADE_DASHBOARD.md",
        "docs/EXTERNAL_SOLUTION_SOURCES.md",
        "docs/GOLDEN_PROFILE_REPOS.md",
        "docs/INVENTORY.json",
        "docs/INVENTORY.md",
        "docs/logging/unreal_ingestion_contract.json",
        "docs/MAINTENANCE_SCHEDULE.md",
        "docs/MEMORY_BANK_QUICKSTART.md",
        "docs/QUICKSTART.md",
        "docs/README.md",
        "docs/RELEASE_CHECKLIST.md",
        "docs/REPO_HEALTH_SELF_ASSESSMENT.md",
        "docs/REPO_KIT_SOURCE_OF_TRUTH.md",
        "docs/REPO_UPGRADE_PLANNER.md",
        "docs/ROLLOUT_RINGS_POLICY.md",
        "docs/SECRETS_BACKUP_POLICY.md",
        "docs/SECRETS_RESTORE_CHECKLIST.md",
        "docs/SECURITY_SUPPLY_CHAIN_PACK.md",
        "docs/SOLUTION_CLI.md",
        "docs/SOLUTION_COLLECTION.md",
        "docs/SOLUTION_DEPOT.md",
        "docs/solutions/README.md",
        "docs/SYNC_STRATEGY.md",
        "docs/TASK_PACK_GENERATOR.md",
        "docs/templates/adr/ADR_template.md",
        "docs/templates/clinerules/01-repo-kit-defaults.md",
        "docs/templates/clinerules/README.md",
        "docs/templates/CODEOWNERS_template",
        "docs/templates/CONTRIBUTING_template.md",
        "docs/templates/devcontainer/base/devcontainer.json",
        "docs/templates/devcontainer/base/post-create.ps1",
        "docs/templates/devcontainer/powershell/devcontainer.json",
        "docs/templates/devcontainer/powershell/post-create.ps1",
        "docs/templates/devcontainer/python/devcontainer.json",
        "docs/templates/devcontainer/python/post-create.ps1",
        "docs/templates/devcontainer/README.md",
        "docs/templates/github/ISSUE_TEMPLATE_bug_report.md",
        "docs/templates/github/ISSUE_TEMPLATE_feature_request.md",
        "docs/templates/github/PULL_REQUEST_TEMPLATE.md",
        "docs/templates/LOGGING_template.md",
        "docs/templates/logging/unified_event_schema_template.json",
        "docs/templates/logging/unreal_ingestion_contract_template.json",
        "docs/templates/logging/unreal_logging_profile_template.json",
        "docs/templates/memory-bank/activeContext_template.md",
        "docs/templates/memory-bank/commonPitfalls_template.md",
        "docs/templates/memory-bank/context-pack_template.md",
        "docs/templates/memory-bank/decisions_template.md",
        "docs/templates/memory-bank/HANDOFF_template.md",
        "docs/templates/memory-bank/productContext_template.md",
        "docs/templates/memory-bank/progress_template.md",
        "docs/templates/memory-bank/projectbrief_template.md",
        "docs/templates/memory-bank/README.md",
        "docs/templates/memory-bank/README_template.md",
        "docs/templates/memory-bank/repoKitCatalog_template.md",
        "docs/templates/memory-bank/solutionHarvest_template.md",
        "docs/templates/memory-bank/systemPatterns_template.md",
        "docs/templates/memory-bank/techContext_template.md",
        "docs/templates/renovate.json",
        "docs/templates/repo-kit/exchange.json",
        "docs/templates/repo-kit/migration_answers.json",
        "docs/templates/secrets/README.md",
        "docs/templates/secrets/restore_env_from_backup.ps1",
        "docs/templates/SECURITY_template.md",
        "docs/templates/solutions/SOLUTION_template.md",
        "docs/templates/tools/update_tools_plan_template.json",
        "docs/templates/unreal/README.md",
        "docs/templates/unreal/Run-CompileAllBlueprints.ps1",
        "docs/templates/unreal/Run-UAT-BuildCookRun.ps1",
        "docs/templates/unreal/Run-UBT-Build.ps1",
        "docs/TESTING_STRATEGY_PACK.md",
        "docs/TODO_AUDIT.md",
        "docs/TODO_PROCESS.md",
        "docs/TOOLS_UPDATE_POLICY.md",
        "docs/UNREAL_CPP_REPO_PACK.md",
        "docs/UNREAL_LOG_INGESTION_CONTRACT.md",
        "docs/UPDATE_IMPACT_POLICY.md",
        "docs/VERSIONING.md",
        "docs/wavekit/perf/runs.jsonl",
        "examples/golden-cpp/CMakeLists.txt",
        "examples/golden-cpp/src/main.cpp",
        "examples/golden-docs-only/docs/TODO.md",
        "examples/golden-powershell/Golden.PowerShell.psd1",
        "examples/golden-powershell/Golden.PowerShell.psm1",
        "examples/golden-python/pyproject.toml",
        "examples/golden-python/src/golden_python/__init__.py",
        "examples/golden-repo/.clineignore",
        "examples/golden-repo/.github/workflows/ci.yml",
        "examples/golden-repo/docs/CLINE_GUIDE.md",
        "examples/golden-repo/docs/CLINE_TASK_CURRENT.md",
        "examples/golden-repo/docs/LOGGING.md",
        "examples/golden-repo/docs/logging/unreal_ingestion_contract.json",
        "examples/golden-repo/scripts/logging/fixtures/unreal_ingest_cases.json",
        "examples/golden-repo/scripts/logging/README.md",
        "examples/golden-repo/scripts/logging/repokit_logging_adapter.py",
        "examples/golden-repo/scripts/logging/RepoKit.LoggingAdapter.psm1",
        "examples/golden-repo/scripts/logging/test_python_logging_adapter_smoke.py",
        "examples/golden-repo/scripts/logging/test_unreal_log_ingest_regression.py",
        "examples/golden-repo/scripts/logging/Test-RepoKitLoggingAdapterSmoke.ps1",
        "examples/golden-repo/scripts/logging/unreal_log_ingest_adapter.py",
        "examples/golden-unreal/compile_commands.json",
        "examples/golden-unreal/GoldenUnreal.uproject",
        "examples/golden-unreal/Source/GoldenUnreal/GoldenUnreal.Build.cs",
        "examples/golden-web/package.json",
        "examples/golden-web/src/index.js",
        "repo-standards/exchange/default_items.json",
        "repo-standards/exchange/exchange.schema.json",
        "repo-standards/exchange/registered_repos.example.txt",
        "repo-standards/migrations/standards_migrations.json",
        "repo-standards/migrations/standards_migrations.schema.json",
        "repo-standards/pack_versions.json",
        "repo-standards/policies/repo_consistency_policy.json",
        "repo-standards/policies/repo_consistency_policy.schema.json",
        "repo-standards/rollout_rings.json",
        "repo-standards/todo/todo_agent_queue.schema.json",
        "scripts/bootstrap/bootstrap_memory_bank.ps1",
        "scripts/bootstrap/install_devcontainer_template.ps1",
        "scripts/bootstrap/install_repo_standards.ps1",
        "scripts/codex-verify.ps1",
        "scripts/doctor/check_host_tools.ps1",
        "scripts/doctor/check_unreal_cpp_pack.ps1",
        "scripts/doctor/repo_doctor.ps1",
        "scripts/exchange/apply_approved_exchange.ps1",
        "scripts/exchange/build_dashboard.ps1",
        "scripts/exchange/catalog_repo.ps1",
        "scripts/exchange/check_drift.ps1",
        "scripts/exchange/check_due.ps1",
        "scripts/exchange/Exchange.Common.ps1",
        "scripts/exchange/propose_exports.ps1",
        "scripts/exchange/propose_imports.ps1",
        "scripts/exchange/README.md",
        "scripts/exchange/watch_due.ps1",
        "scripts/inventory/generate_inventory.py",
        "scripts/inventory/purpose_metadata.json",
        "scripts/lifecycle/check_external_solution_sources.py",
        "scripts/lifecycle/check_golden_profiles.py",
        "scripts/lifecycle/check_golden_repo.py",
        "scripts/lifecycle/check_logging_contract.py",
        "scripts/lifecycle/check_memory_bank.py",